{
  "type": "hello",
  "t": 1203411,
  "id": "h1",
  "data": {
    "protocol": "three-maze/link",
    "version": "1.0",
    "role": "motion",
    "client": { "impl": "three-maze-motion-worker", "version": "0.3.0" },
    "session": "2026-10-23T14-03-11Z_m12",
    "versions": { "electron": "44.7.0", "three": "0.169.0", "rapier3d-compat": "0.14.0" }
  }
}
